{
  "schema_version": 1,
  "rules_version": "post-draft-report-rules-v1",
  "explanation_template_version": "post-draft-report-explanations-v1",
  "availability_states": [
    "supported",
    "limited",
    "unavailable",
    "not_applicable"
  ],
  "confidence_states": [
    "high",
    "medium",
    "low",
    "unavailable"
  ],
  "section_registry": [
    {
      "section_key": "draft_summary",
      "title": "Draft summary",
      "availability_rule": "always_supported",
      "confidence_ceiling": "high",
      "applicable_modes": [
        "live",
        "mock"
      ],
      "reason_codes": [],
      "limitation_codes": []
    },
    {
      "section_key": "position_inventory",
      "title": "Position inventory",
      "availability_rule": "always_supported",
      "confidence_ceiling": "high",
      "applicable_modes": [
        "live",
        "mock"
      ],
      "reason_codes": [],
      "limitation_codes": []
    },
    {
      "section_key": "starter_coverage",
      "title": "Starter coverage",
      "availability_rule": "normalized_league_shape",
      "confidence_ceiling": "high",
      "applicable_modes": [
        "live",
        "mock"
      ],
      "reason_codes": [
        "STARTER_ASSIGNMENT_COMPLETE",
        "STARTER_ASSIGNMENT_PARTIAL",
        "STARTER_SHAPE_UNAVAILABLE"
      ],
      "limitation_codes": [
        "PLAYER_ELIGIBILITY_INCOMPLETE"
      ]
    },
    {
      "section_key": "roster_concentration",
      "title": "Roster-construction concentration",
      "availability_rule": "normalized_league_shape",
      "confidence_ceiling": "high",
      "applicable_modes": [
        "live",
        "mock"
      ],
      "reason_codes": [
        "BALANCED_DISTRIBUTION",
        "CONCENTRATED",
        "COVERAGE_GAP",
        "HIGHLY_CONCENTRATED"
      ],
      "limitation_codes": [
        "PLAYER_ELIGIBILITY_INCOMPLETE"
      ]
    },
    {
      "section_key": "year_one_production_context",
      "title": "Year-one production context",
      "availability_rule": "categorical_evidence_coverage",
      "confidence_ceiling": "medium",
      "applicable_modes": [
        "live",
        "mock"
      ],
      "reason_codes": [
        "PRODUCTION_EVIDENCE_AVAILABLE",
        "PRODUCTION_EVIDENCE_LIMITED",
        "PRODUCTION_EVIDENCE_UNAVAILABLE"
      ],
      "limitation_codes": [
        "CATEGORICAL_SINGLE_SOURCE",
        "NOT_A_PROJECTION"
      ]
    },
    {
      "section_key": "dynasty_market_context",
      "title": "Dynasty market context",
      "availability_rule": "categorical_evidence_coverage",
      "confidence_ceiling": "medium",
      "applicable_modes": [
        "live",
        "mock"
      ],
      "reason_codes": [
        "MARKET_EVIDENCE_AVAILABLE",
        "MARKET_EVIDENCE_LIMITED",
        "MARKET_EVIDENCE_UNAVAILABLE"
      ],
      "limitation_codes": [
        "CATEGORICAL_SINGLE_SOURCE",
        "NOT_A_ROSTER_VALUE"
      ]
    },
    {
      "section_key": "age_risk_profile",
      "title": "Age-risk profile",
      "availability_rule": "categorical_evidence_coverage",
      "confidence_ceiling": "medium",
      "applicable_modes": [
        "live",
        "mock"
      ],
      "reason_codes": [
        "AGE_RISK_EVIDENCE_AVAILABLE",
        "AGE_RISK_EVIDENCE_LIMITED",
        "AGE_RISK_EVIDENCE_UNAVAILABLE"
      ],
      "limitation_codes": [
        "CATEGORICAL_SINGLE_SOURCE",
        "NOT_AN_AVERAGE_AGE"
      ]
    },
    {
      "section_key": "long_term_value",
      "title": "Long-term dynasty value",
      "availability_rule": "always_unavailable_v1",
      "confidence_ceiling": "unavailable",
      "applicable_modes": [
        "live",
        "mock"
      ],
      "reason_codes": [
        "LONG_TERM_VALUE_EVIDENCE_UNAVAILABLE"
      ],
      "limitation_codes": [
        "MARKET_BAND_IS_NOT_LONG_TERM_OUTCOME"
      ]
    },
    {
      "section_key": "liquidity",
      "title": "Liquidity",
      "availability_rule": "always_unavailable_v1",
      "confidence_ceiling": "unavailable",
      "applicable_modes": [
        "live",
        "mock"
      ],
      "reason_codes": [
        "LIQUIDITY_EVIDENCE_UNAVAILABLE"
      ],
      "limitation_codes": [
        "MARKET_BAND_IS_NOT_LIQUIDITY"
      ]
    },
    {
      "section_key": "player_fragility",
      "title": "Player fragility",
      "availability_rule": "always_unavailable_v1",
      "confidence_ceiling": "unavailable",
      "applicable_modes": [
        "live",
        "mock"
      ],
      "reason_codes": [
        "PLAYER_FRAGILITY_EVIDENCE_UNAVAILABLE"
      ],
      "limitation_codes": [
        "INJURY_CONTRACT_ROLE_EVIDENCE_REQUIRED"
      ]
    },
    {
      "section_key": "strategy_story",
      "title": "Strategy story",
      "availability_rule": "mock_saved_history",
      "confidence_ceiling": "high",
      "applicable_modes": [
        "live",
        "mock"
      ],
      "reason_codes": [
        "LIVE_STRATEGY_NOT_APPLICABLE",
        "MOCK_STRATEGY_HISTORY_AVAILABLE",
        "MOCK_STRATEGY_HISTORY_LIMITED"
      ],
      "limitation_codes": [
        "SAVED_EVENTS_ONLY"
      ]
    },
    {
      "section_key": "personal_board_choice_moments",
      "title": "Personal Board choice moments",
      "availability_rule": "frozen_board_snapshot",
      "confidence_ceiling": "high",
      "applicable_modes": [
        "live",
        "mock"
      ],
      "reason_codes": [
        "NO_QUALIFYING_PERSONAL_BOARD_MOMENTS",
        "PERSONAL_BOARD_MOMENTS_AVAILABLE"
      ],
      "limitation_codes": [
        "PERSONAL_BOARD_OBSERVATION_ONLY"
      ]
    },
    {
      "section_key": "recorded_alert_moments",
      "title": "Recorded alert moments",
      "availability_rule": "saved_alert_history",
      "confidence_ceiling": "high",
      "applicable_modes": [
        "live",
        "mock"
      ],
      "reason_codes": [
        "ALERTS_CONFIGURED_NO_EVENTS",
        "ALERTS_DISABLED_AT_COMPLETION",
        "ALERTS_NOT_CONFIGURED",
        "ALERT_EVENTS_AVAILABLE",
        "ALERT_HISTORY_CORRUPT"
      ],
      "limitation_codes": [
        "SAVED_EVENTS_ONLY"
      ]
    },
    {
      "section_key": "evidence_limits",
      "title": "Evidence limits",
      "availability_rule": "always_supported",
      "confidence_ceiling": "high",
      "applicable_modes": [
        "live",
        "mock"
      ],
      "reason_codes": [
        "REPORT_LIMITS_DISCLOSED"
      ],
      "limitation_codes": [
        "NO_OUTCOME_PROJECTION",
        "USER_JUDGMENT_AUTHORITATIVE"
      ]
    }
  ],
  "starter_assignment": {
    "algorithm": "maximum_bipartite_matching",
    "objective": "maximize_filled_starter_slots",
    "slot_order_origin": 0,
    "tie_break_fields": [
      "slot_order",
      "overall_pick",
      "canonical_player_id"
    ],
    "assignment_vector_order": "lexicographically_smallest_filled_edge_tuple_list",
    "unknown_eligibility": "no_edge_and_limited_when_assignment_remains_usable",
    "depth_grouping": "frozen_primary_position",
    "ambiguous_flex_rule": "chosen_player_replaceable_in_another_maximum_assignment",
    "supported_slot_types": {
      "QB": [
        "QB"
      ],
      "RB": [
        "RB"
      ],
      "WR": [
        "WR"
      ],
      "TE": [
        "TE"
      ],
      "FLEX": [
        "RB",
        "WR",
        "TE"
      ],
      "SUPER_FLEX": [
        "QB",
        "RB",
        "WR",
        "TE"
      ]
    }
  },
  "evidence_coverage": {
    "formula": "floor(covered_players*10000/roster_players)",
    "limited_minimum_basis_points": 5000,
    "supported_minimum_basis_points": 8000,
    "below_limited_availability": "unavailable",
    "limited_availability": "limited",
    "supported_availability": "supported",
    "supported_confidence": "medium",
    "limited_confidence": "low",
    "unavailable_confidence": "unavailable",
    "confidence_ceiling": "medium",
    "blocking_evidence_states": [
      "expired",
      "incompatible",
      "invalid"
    ],
    "applies_to_sections": [
      "age_risk_profile",
      "dynasty_market_context",
      "year_one_production_context"
    ]
  },
  "concentration": {
    "formula": "floor(position_pick_count*10000/total_user_picks)",
    "balanced_maximum_basis_points": 4000,
    "highly_concentrated_above_basis_points": 5500,
    "balanced_requires_full_distinct_starter_coverage": true,
    "coverage_gap_can_coexist": true,
    "share_bands": [
      "balanced_distribution",
      "concentrated",
      "highly_concentrated"
    ]
  },
  "limits": {
    "maximum_candidates": 500,
    "maximum_user_roster_picks": 60,
    "maximum_sections": 100,
    "maximum_personal_board_moments": 10,
    "maximum_exported_alert_moments": 20,
    "minimum_comparison_reports": 2,
    "maximum_comparison_reports": 4
  },
  "explanation_templates": [
    {
      "template_key": "starter.coverage_complete",
      "section_key": "starter_coverage",
      "template": "All {starter_slots_total} configured starter slots can be covered by the drafted roster.",
      "required_placeholders": [
        "starter_slots_total"
      ]
    },
    {
      "template_key": "starter.coverage_partial",
      "section_key": "starter_coverage",
      "template": "{starter_slots_filled} of {starter_slots_total} configured starter slots can be covered; review the unfilled slot labels.",
      "required_placeholders": [
        "starter_slots_filled",
        "starter_slots_total"
      ]
    },
    {
      "template_key": "starter.coverage_unavailable",
      "section_key": "starter_coverage",
      "template": "Starter coverage is unavailable because the saved league starter shape could not be normalized.",
      "required_placeholders": []
    },
    {
      "template_key": "concentration.balanced",
      "section_key": "roster_concentration",
      "template": "No position accounts for more than {balanced_maximum_percent}% of the roster, and every distinct starter position is covered.",